{
  "schema_version": "winghostty.verification.result.v1",
  "scenario_id": "windows.portable-cli.x64",
  "status": "pass",
  "started_at": "2026-07-11T00:00:00Z",
  "finished_at": "2026-07-11T00:00:01Z",
  "duration_ms": 1000,
  "baseline_commit": null,
  "implementation_commit": "77c5354f60000000000000000000000000000000",
  "environment": { "os": "Windows", "architecture": "x86_64" },
  "measurements": {},
  "assertions": [{ "id": "cli-contract", "status": "pass", "message": null }],
  "artifacts": [{ "kind": "log", "path": "transcript.log", "sha256": null }],
  "failure": null
}
